<?xml version="1.0" encoding="utf-8"?>
<!DOCTYPE population SYSTEM "http://www.matsim.org/files/dtd/population_v5.dtd">

<population>

<!-- ====================================================================== -->

	<person id="0" employed="yes" >
		<plan selected="yes">
			<act type="h" facility="0" x="0.0" y="-375.0" start_time="00:00:00" max_dur="08:00:00" end_time="08:00:00" />
			<leg mode="car">
			</leg>
			<act type="w" facility="3" x="1000.0" y="-250.0" start_time="08:00:00" max_dur="08:00:00" />
            <leg mode="car">
			</leg>
			<act type="h" facility="0" x="0.0" y="-375.0" start_time="08:00:00" max_dur="08:00:00" />
			<leg mode="car">
			</leg>
			<act type="w" facility="3" x="1000.0" y="-250.0" start_time="08:00:00" max_dur="08:00:00" />
            <leg mode="car">
			</leg>
			<act type="h" facility="0" x="0.0" y="-375.0" start_time="08:00:00" />
		</plan>

	</person>

<!-- ====================================================================== -->

	<person id="1" employed="yes" >
		<plan selected="yes">
			<act type="h" facility="1" x="-375.0" y="0.0" start_time="00:00:03" max_dur="08:00:00" end_time="08:00:03" />
			<leg mode="car">
			</leg>
			<act type="w" facility="4" x="1250.0" y="0.0" start_time="08:00:03" max_dur="08:00:00" />
            <leg mode="car">
			</leg>
            <act type="h" facility="1" x="-375.0" y="0.0" start_time="08:00:03" max_dur="08:00:00" end_time="16:00:03" />

		</plan>

	</person>

<!-- ====================================================================== -->

	<person id="10" employed="yes">
		<plan selected="yes">
			<act type="h" facility="1" x="-375.0" y="0.0" start_time="00:00:36" max_dur="08:00:00" end_time="08:00:36" />
			<leg mode="car">
			</leg>
			<act type="w" facility="4" x="1250.0" y="0.0" start_time="08:00:36" max_dur="08:00:00" />
            <leg mode="car">
			</leg>
            <act type="h" facility="1" x="-375.0" y="0.0" start_time="08:00:36" max_dur="08:00:00" end_time="16:00:36" />
		</plan>

	</person>

<!-- ====================================================================== -->

	<person id="100" employed="yes">
		<plan selected="yes">
			<act type="h" facility="1" x="-375.0" y="0.0" start_time="00:06:00" max_dur="08:00:00" end_time="08:06:00" />
			<leg mode="car">
			</leg>
			<act type="w" facility="4" x="1250.0" y="0.0" start_time="08:06:00" max_dur="08:00:00" />
            <leg mode="car">
			</leg>
            <act type="h" facility="1" x="-375.0" y="0.0" start_time="08:06:00" max_dur="08:00:00" end_time="16:06:00" />
		</plan>

	</person>

<!-- ====================================================================== -->

	<person id="101" employed="yes">
		<plan selected="yes">
			<act type="h" facility="2" x="0.0" y="375.0" start_time="00:06:03" max_dur="08:00:00" end_time="08:06:03" />
			<leg mode="car">
			</leg>
			<act type="w" facility="5" x="1000.0" y="250.0" start_time="08:06:03" max_dur="08:00:00" />
            <leg mode="car">
			</leg>
            <act type="h" facility="2" x="0.0" y="375.0" start_time="08:06:03" max_dur="08:00:00" end_time="16:06:03" />
		</plan>

	</person>

<!-- ====================================================================== -->

	<person id="102" employed="yes">
		<plan selected="yes">
			<act type="h" facility="0" x="0.0" y="-375.0" start_time="00:06:07" max_dur="08:00:00" end_time="08:06:07" />
			<leg mode="car">
			</leg>
			<act type="w" facility="3" x="1000.0" y="-250.0" start_time="08:06:07" max_dur="08:00:00" />
            <leg mode="car">
			</leg>
            <act type="h" facility="0" x="0.0" y="-375.0" start_time="08:06:07" max_dur="08:00:00" end_time="16:06:07" />
		</plan>

	</person>

<!-- ====================================================================== -->

	<person id="103" employed="yes">
		<plan selected="yes">
			<act type="h" facility="1" x="-375.0" y="0.0" start_time="00:06:10" max_dur="08:00:00" end_time="08:06:10" />
			<leg mode="car">
			</leg>
			<act type="w" facility="4" x="1250.0" y="0.0" start_time="08:06:10" max_dur="08:00:00" />
            <leg mode="car">
			</leg>
            <act type="h" facility="1" x="-375.0" y="0.0" start_time="08:06:10" max_dur="08:00:00" end_time="16:06:10" />
		</plan>

	</person>

<!-- ====================================================================== -->

	<person id="104" employed="yes">
		<plan selected="yes">
			<act type="h" facility="2" x="0.0" y="375.0" start_time="00:06:14" max_dur="08:00:00" end_time="08:06:14" />
			<leg mode="car">
			</leg>
			<act type="w" facility="5" x="1000.0" y="250.0" start_time="08:06:14" max_dur="08:00:00" />
            <leg mode="car">
			</leg>
            <act type="h" facility="2" x="0.0" y="375.0" start_time="08:06:14" max_dur="08:00:00" end_time="16:06:14" />
		</plan>

	</person>

<!-- ====================================================================== -->

	<person id="105" employed="yes">
		<plan selected="yes">
			<act type="h" facility="0" x="0.0" y="-375.0" start_time="00:06:18" max_dur="08:00:00" end_time="08:06:18" />
			<leg mode="car">
			</leg>
			<act type="w" facility="3" x="1000.0" y="-250.0" start_time="08:06:18" max_dur="08:00:00" />
            <leg mode="car">
			</leg>
            <act type="h" facility="0" x="0.0" y="-375.0" start_time="08:06:18" max_dur="08:00:00" end_time="16:06:18" />
		</plan>

	</person>

<!-- ====================================================================== -->

	<person id="106" employed="yes">
		<plan selected="yes">
			<act type="h" facility="1" x="-375.0" y="0.0" start_time="00:06:21" max_dur="08:00:00" end_time="08:06:21" />
			<leg mode="car">
			</leg>
			<act type="w" facility="4" x="1250.0" y="0.0" start_time="08:06:21" max_dur="08:00:00" />
            <leg mode="car">
			</leg>
            <act type="h" facility="1" x="-375.0" y="0.0" start_time="08:06:21" max_dur="08:00:00" end_time="16:06:21" />
		</plan>

	</person>

<!-- ====================================================================== -->

</population>
