<?xml version="1.0" encoding="utf-8"?>
<!DOCTYPE population SYSTEM "http://www.matsim.org/files/dtd/population_v5.dtd">

<population>

	<!-- ====================================================================== -->

	<person id="1" employed="no">
		<plan selected="yes">
			<act type="h" link="1" />
			<leg mode="car">
				<route type="links">1 2</route>
			</leg>
			<leg mode="car">
				<route type="links">2 3 4</route>
			</leg>
			<leg mode="car">
				<route type="links">4 5 6</route>
			</leg>
			<act type="h" link="6" />
		</plan>

	</person>

	<!-- ====================================================================== -->

</population>
