<?xml version="1.0" encoding="utf-8"?>
<!DOCTYPE population SYSTEM "http://www.matsim.org/files/dtd/population_v5.dtd">

<population>

<!-- ====================================================================== -->

	<person id="1" employed="no">
		<plan selected="yes">
			<act type="h" link="1" end_time="06:00:00" />
			<leg mode="car">
				<route type="links">1 2 11 20</route>
			</leg>
			<act type="w" link="20" max_dur="00:30:00" />
			<leg mode="car">
				<route type="links">20 21 22 23 1</route>
			</leg>
			<act type="h" link="1" />
		</plan>
		
		<plan selected="no">
			<act type="h" link="1" end_time="06:00:00" />
			<leg mode="car">
				<route type="links">1 10 19 20</route>
			</leg>
			<act type="w" link="20" max_dur="00:30:00" />
			<leg mode="car">
				<route type="links">20 21 22 23 1</route>
			</leg>
			<act type="h" link="1" />
		</plan>

	</person>

<!-- ====================================================================== -->

	<person id="2" employed="no">
		<plan selected="yes">
			<act type="h" link="1" end_time="06:00:00" />
			<leg mode="car">
				<route type="links">1 2 11 20</route>
			</leg>
			<act type="w" link="20" max_dur="00:30:00" />
			<leg mode="car">
				<route type="links">20 21 22 23 1</route>
			</leg>
			<act type="h" link="1" />
		</plan>
		
		<plan selected="no">
			<act type="h" link="1" end_time="06:00:00" />
			<leg mode="car">
				<route type="links">1 10 19 20</route>
			</leg>
			<act type="w" link="20" max_dur="00:30:00" />
			<leg mode="car">
				<route type="links">20 21 22 23 1</route>
			</leg>
			<act type="h" link="1" />
		</plan>

	</person>

<!-- ====================================================================== -->

	<person id="3" employed="no">
		<plan selected="yes">
			<act type="h" link="1" end_time="06:00:00" />
			<leg mode="car">
				<route type="links">1 2 11 20</route>
			</leg>
			<act type="w" link="20" max_dur="00:30:00" />
			<leg mode="car">
				<route type="links">20 21 22 23 1</route>
			</leg>
			<act type="h" link="1" />
		</plan>
		
		<plan selected="no">
			<act type="h" link="1" end_time="06:00:00" />
			<leg mode="car">
				<route type="links">1 10 19 20</route>
			</leg>
			<act type="w" link="20" max_dur="00:30:00" />
			<leg mode="car">
				<route type="links">20 21 22 23 1</route>
			</leg>
			<act type="h" link="1" />
		</plan>

	</person>

<!-- ====================================================================== -->

	<person id="4" employed="no">
		<plan selected="yes">
			<act type="h" link="1" end_time="06:00:00" />
			<leg mode="car">
				<route type="links">1 2 11 20</route>
			</leg>
			<act type="w" link="20" max_dur="00:30:00" />
			<leg mode="car">
				<route type="links">20 21 22 23 1</route>
			</leg>
			<act type="h" link="1" />
		</plan>
		
		<plan selected="no">
			<act type="h" link="1" end_time="06:00:00" />
			<leg mode="car">
				<route type="links">1 10 19 20</route>
			</leg>
			<act type="w" link="20" max_dur="00:30:00" />
			<leg mode="car">
				<route type="links">20 21 22 23 1</route>
			</leg>
			<act type="h" link="1" />
		</plan>

	</person>

<!-- ====================================================================== -->

	<person id="5" employed="no">
		<plan selected="yes">
			<act type="h" link="1" end_time="06:00:00" />
			<leg mode="car">
				<route type="links">1 2 11 20</route>
			</leg>
			<act type="w" link="20" max_dur="00:30:00" />
			<leg mode="car">
				<route type="links">20 21 22 23 1</route>
			</leg>
			<act type="h" link="1" />
		</plan>
		
		<plan selected="no">
			<act type="h" link="1" end_time="06:00:00" />
			<leg mode="car">
				<route type="links">1 10 19 20</route>
			</leg>
			<act type="w" link="20" max_dur="00:30:00" />
			<leg mode="car">
				<route type="links">20 21 22 23 1</route>
			</leg>
			<act type="h" link="1" />
		</plan>

	</person>

<!-- ====================================================================== -->

</population>
