<?xml version="1.0" encoding="utf-8"?>
<!DOCTYPE population SYSTEM "http://www.matsim.org/files/dtd/population_v5.dtd">

<population>

<!-- ====================================================================== -->

	<person id="bike_home1_work1_0">
		<plan selected="yes">
			<act type="home" x="4594056.246772228" y="5815823.958524446" end_time="10:00:00" />
			<leg mode="bike">
			</leg>
			<act type="work" x="4597061.15798372" y="5815895.2771292785" end_time="17:00:00" />
			<leg mode="bike">
			</leg>
			<act type="home" x="4594056.246772228" y="5815823.958524446" end_time="10:00:00" />
		</plan>

	</person>

<!-- ====================================================================== -->

	<person id="bike_home1_work1_1">
		<plan selected="yes">
			<act type="home" x="4594056.246772228" y="5815823.958524446" end_time="10:01:00" />
			<leg mode="bike">
			</leg>
			<act type="work" x="4597061.15798372" y="5815895.2771292785" end_time="17:01:00" />
			<leg mode="bike">
			</leg>
			<act type="home" x="4594056.246772228" y="5815823.958524446" end_time="10:01:00" />
		</plan>

	</person>

<!-- ====================================================================== -->

	<person id="bike_home1_work1_10">
		<plan selected="yes">
			<act type="home" x="4594056.246772228" y="5815823.958524446" end_time="10:10:00" />
			<leg mode="bike">
			</leg>
			<act type="work" x="4597061.15798372" y="5815895.2771292785" end_time="17:10:00" />
			<leg mode="bike">
			</leg>
			<act type="home" x="4594056.246772228" y="5815823.958524446" end_time="10:10:00" />
		</plan>

	</person>

<!-- ====================================================================== -->

	<person id="bike_home1_work1_11">
		<plan selected="yes">
			<act type="home" x="4594056.246772228" y="5815823.958524446" end_time="10:11:00" />
			<leg mode="bike">
			</leg>
			<act type="work" x="4597061.15798372" y="5815895.2771292785" end_time="17:11:00" />
			<leg mode="bike">
			</leg>
			<act type="home" x="4594056.246772228" y="5815823.958524446" end_time="10:11:00" />
		</plan>

	</person>

<!-- ====================================================================== -->

	<person id="bike_home1_work1_12">
		<plan selected="yes">
			<act type="home" x="4594056.246772228" y="5815823.958524446" end_time="10:12:00" />
			<leg mode="bike">
			</leg>
			<act type="work" x="4597061.15798372" y="5815895.2771292785" end_time="17:12:00" />
			<leg mode="bike">
			</leg>
			<act type="home" x="4594056.246772228" y="5815823.958524446" end_time="10:12:00" />
		</plan>

	</person>

<!-- ====================================================================== -->

	<person id="bike_home1_work1_13">
		<plan selected="yes">
			<act type="home" x="4594056.246772228" y="5815823.958524446" end_time="10:13:00" />
			<leg mode="bike">
			</leg>
			<act type="work" x="4597061.15798372" y="5815895.2771292785" end_time="17:13:00" />
			<leg mode="bike">
			</leg>
			<act type="home" x="4594056.246772228" y="5815823.958524446" end_time="10:13:00" />
		</plan>

	</person>

<!-- ====================================================================== -->

	<person id="bike_home1_work1_14">
		<plan selected="yes">
			<act type="home" x="4594056.246772228" y="5815823.958524446" end_time="10:14:00" />
			<leg mode="bike">
			</leg>
			<act type="work" x="4597061.15798372" y="5815895.2771292785" end_time="17:14:00" />
			<leg mode="bike">
			</leg>
			<act type="home" x="4594056.246772228" y="5815823.958524446" end_time="10:14:00" />
		</plan>

	</person>

<!-- ====================================================================== -->

	<person id="bike_home1_work1_15">
		<plan selected="yes">
			<act type="home" x="4594056.246772228" y="5815823.958524446" end_time="10:15:00" />
			<leg mode="bike">
			</leg>
			<act type="work" x="4597061.15798372" y="5815895.2771292785" end_time="17:15:00" />
			<leg mode="bike">
			</leg>
			<act type="home" x="4594056.246772228" y="5815823.958524446" end_time="10:15:00" />
		</plan>

	</person>

<!-- ====================================================================== -->

	<person id="bike_home1_work1_16">
		<plan selected="yes">
			<act type="home" x="4594056.246772228" y="5815823.958524446" end_time="10:16:00" />
			<leg mode="bike">
			</leg>
			<act type="work" x="4597061.15798372" y="5815895.2771292785" end_time="17:16:00" />
			<leg mode="bike">
			</leg>
			<act type="home" x="4594056.246772228" y="5815823.958524446" end_time="10:16:00" />
		</plan>

	</person>

<!-- ====================================================================== -->

	<person id="bike_home1_work1_17">
		<plan selected="yes">
			<act type="home" x="4594056.246772228" y="5815823.958524446" end_time="10:17:00" />
			<leg mode="bike">
			</leg>
			<act type="work" x="4597061.15798372" y="5815895.2771292785" end_time="17:17:00" />
			<leg mode="bike">
			</leg>
			<act type="home" x="4594056.246772228" y="5815823.958524446" end_time="10:17:00" />
		</plan>

	</person>

<!-- ====================================================================== -->

	<person id="bike_home1_work1_18">
		<plan selected="yes">
			<act type="home" x="4594056.246772228" y="5815823.958524446" end_time="10:18:00" />
			<leg mode="bike">
			</leg>
			<act type="work" x="4597061.15798372" y="5815895.2771292785" end_time="17:18:00" />
			<leg mode="bike">
			</leg>
			<act type="home" x="4594056.246772228" y="5815823.958524446" end_time="10:18:00" />
		</plan>

	</person>

<!-- ====================================================================== -->

	<person id="bike_home1_work1_19">
		<plan selected="yes">
			<act type="home" x="4594056.246772228" y="5815823.958524446" end_time="10:19:00" />
			<leg mode="bike">
			</leg>
			<act type="work" x="4597061.15798372" y="5815895.2771292785" end_time="17:19:00" />
			<leg mode="bike">
			</leg>
			<act type="home" x="4594056.246772228" y="5815823.958524446" end_time="10:19:00" />
		</plan>

	</person>

<!-- ====================================================================== -->

	<person id="bike_home1_work1_2">
		<plan selected="yes">
			<act type="home" x="4594056.246772228" y="5815823.958524446" end_time="10:02:00" />
			<leg mode="bike">
			</leg>
			<act type="work" x="4597061.15798372" y="5815895.2771292785" end_time="17:02:00" />
			<leg mode="bike">
			</leg>
			<act type="home" x="4594056.246772228" y="5815823.958524446" end_time="10:02:00" />
		</plan>

	</person>

<!-- ====================================================================== -->

	<person id="bike_home1_work1_3">
		<plan selected="yes">
			<act type="home" x="4594056.246772228" y="5815823.958524446" end_time="10:03:00" />
			<leg mode="bike">
			</leg>
			<act type="work" x="4597061.15798372" y="5815895.2771292785" end_time="17:03:00" />
			<leg mode="bike">
			</leg>
			<act type="home" x="4594056.246772228" y="5815823.958524446" end_time="10:03:00" />
		</plan>

	</person>

<!-- ====================================================================== -->

	<person id="bike_home1_work1_4">
		<plan selected="yes">
			<act type="home" x="4594056.246772228" y="5815823.958524446" end_time="10:04:00" />
			<leg mode="bike">
			</leg>
			<act type="work" x="4597061.15798372" y="5815895.2771292785" end_time="17:04:00" />
			<leg mode="bike">
			</leg>
			<act type="home" x="4594056.246772228" y="5815823.958524446" end_time="10:04:00" />
		</plan>

	</person>

<!-- ====================================================================== -->

	<person id="bike_home1_work1_5">
		<plan selected="yes">
			<act type="home" x="4594056.246772228" y="5815823.958524446" end_time="10:05:00" />
			<leg mode="bike">
			</leg>
			<act type="work" x="4597061.15798372" y="5815895.2771292785" end_time="17:05:00" />
			<leg mode="bike">
			</leg>
			<act type="home" x="4594056.246772228" y="5815823.958524446" end_time="10:05:00" />
		</plan>

	</person>

<!-- ====================================================================== -->

	<person id="bike_home1_work1_6">
		<plan selected="yes">
			<act type="home" x="4594056.246772228" y="5815823.958524446" end_time="10:06:00" />
			<leg mode="bike">
			</leg>
			<act type="work" x="4597061.15798372" y="5815895.2771292785" end_time="17:06:00" />
			<leg mode="bike">
			</leg>
			<act type="home" x="4594056.246772228" y="5815823.958524446" end_time="10:06:00" />
		</plan>

	</person>

<!-- ====================================================================== -->

	<person id="bike_home1_work1_7">
		<plan selected="yes">
			<act type="home" x="4594056.246772228" y="5815823.958524446" end_time="10:07:00" />
			<leg mode="bike">
			</leg>
			<act type="work" x="4597061.15798372" y="5815895.2771292785" end_time="17:07:00" />
			<leg mode="bike">
			</leg>
			<act type="home" x="4594056.246772228" y="5815823.958524446" end_time="10:07:00" />
		</plan>

	</person>

<!-- ====================================================================== -->

	<person id="bike_home1_work1_8">
		<plan selected="yes">
			<act type="home" x="4594056.246772228" y="5815823.958524446" end_time="10:08:00" />
			<leg mode="bike">
			</leg>
			<act type="work" x="4597061.15798372" y="5815895.2771292785" end_time="17:08:00" />
			<leg mode="bike">
			</leg>
			<act type="home" x="4594056.246772228" y="5815823.958524446" end_time="10:08:00" />
		</plan>

	</person>

<!-- ====================================================================== -->

	<person id="bike_home1_work1_9">
		<plan selected="yes">
			<act type="home" x="4594056.246772228" y="5815823.958524446" end_time="10:09:00" />
			<leg mode="bike">
			</leg>
			<act type="work" x="4597061.15798372" y="5815895.2771292785" end_time="17:09:00" />
			<leg mode="bike">
			</leg>
			<act type="home" x="4594056.246772228" y="5815823.958524446" end_time="10:09:00" />
		</plan>

	</person>

<!-- ====================================================================== -->

</population>
